id,url,fullText,clean_txt,label,logistic_regression_pred,weighted-naive-bayes-lr_pred,logistic_regression_pred_label,weighted-naive-bayes-lr_pred_label
1.68e+18,https://x.com/elonmusk/status/1679717154973945856,"@stevenmarkryan It’s not exactly per impression. What matters is how many ads were shown to other verified users.

Only verified users count, as it is otherwise trivial to game the system with bots.","It's not exactly per impression. What matters is how many ads were shown to other verified users. Only verified users count, as it is otherwise trivial to game the system with bots.",1,2,1,positive,neutral
1.48e+18,https://x.com/elonmusk/status/1482598301694238723,So informative https://t.co/rTktvhYukK,So informative,2,1,0,neutral,negative
1.43e+18,https://x.com/elonmusk/status/1429689615707824128,@lexfridman @karpathy My son asked if we would still speak English 7000 years from now. I said probably not. There was not even the faintest hint of English 7000 years ago.,My son asked if we would still speak English 7000 years from now. I said probably not. There was not even the faintest hint of English 7000 years ago.,1,0,1,negative,neutral
1.54e+17,https://x.com/elonmusk/status/153519464653127680,"@FareedZakaria However, China's real estate crisis will explode in a way that makes ours look puny. They can't hide it for much longer.","However, China's real estate crisis will explode in a way that makes ours look puny. They can't hide it for much longer.",0,0,2,negative,positive
1.77e+18,https://x.com/elonmusk/status/1770073471608852762,@RepThomasMassie Or a strong-willed President,Or a strong-willed President,1,2,1,positive,neutral
1.89e+18,https://x.com/elonmusk/status/1886637579577020896,Don’t mess with @DOGE https://t.co/wgdJBxNzyG,Don't mess with,1,1,0,neutral,negative
4.96e+17,https://x.com/DarbsenWtf/status/496010572333580288,"Netflix doet kut, dus dan maar teringherrie pompen. Iemand nog suggesties?","Netflix doet kut, dus dan maar teringherrie pompen. Iemand nog suggesties?",1,0,1,negative,neutral
1.6e+18,https://x.com/elonmusk/status/1595551706749624321,"@semaforben All public holders of Twitter were allowed to roll their stock into Twitter as a private company, but he did not do so. Your reporting made it falsely sound like he did, when in fact he owns 0%. 

For the last time, how much of you does SBF own? Stop dodging the question.","All public holders of Twitter were allowed to roll their stock into Twitter as a private company, but he did not do so. Your reporting made it falsely sound like he did, when in fact he owns 0%. For the last time, how much of you does SBF own? Stop dodging the question.",0,2,1,positive,neutral
1.85e+18,https://x.com/elonmusk/status/1851971319111262506,Let us know if you’ve been illegally fired for expressing your political views,Let us know if you've been illegally fired for expressing your political views,0,1,0,neutral,negative
1.87e+18,https://x.com/elonmusk/status/1873936504520925233,@teslaownersSV It just literally is,It just literally is,1,1,0,neutral,negative
1.32e+18,https://x.com/elonmusk/status/1319059307804045316,"@WholeMarsBlog Not intentional! We just wanted to show that you could theoretically convert the entire US vehicle fleet to electric using only the lithium in Nevada, a single state. Tesla will do lithium mining only as needed. We also found a way to extract lithium using NaCl (table salt).","Not intentional! We just wanted to show that you could theoretically convert the entire US vehicle fleet to electric using only the lithium in Nevada, a single state. Tesla will do lithium mining only as needed. We also found a way to extract lithium using NaCl (table salt).",2,2,0,positive,negative
1.62e+18,https://x.com/elonmusk/status/1615192220419887105,@BillyM2k Should Twitter keep it active?,Should Twitter keep it active?,1,2,1,positive,neutral
1.47e+18,https://x.com/elonmusk/status/1465761470147346435,"@GerberKawasaki We had to shift some Starlink satellite orbits to reduce probability of collision. Not great, but not terrible either.

Station &amp; Dragon have micrometeorite shields (ultra high velocity impact absorption), but EVA suits do not, hence higher risk for spacewalk.","We had to shift some Starlink satellite orbits to reduce probability of collision. Not great, but not terrible either. Station & Dragon have micrometeorite shields (ultra high velocity impact absorption), but EVA suits do not, hence higher risk for spacewalk.",1,0,1,negative,neutral
1.66e+18,https://x.com/elonmusk/status/1662764138043518977,@zerohedge For obvious &amp; sensible reasons,For obvious & sensible reasons,1,0,1,negative,neutral
7.17e+17,https://x.com/elonmusk/status/716750603813318656,@PeteEhmKay @gerardomarina what's the link to that?,what's the link to that?,1,2,1,positive,neutral
1.74e+18,https://x.com/elonmusk/status/1744780200045384116,"@jacksonhinklle @qassam2024 Hamas was calling for the extinction of Israel and, unlike Iran which does the same, are not recognized as leaders of a country by the UN","Hamas was calling for the extinction of Israel and, unlike Iran which does the same, are not recognized as leaders of a country by the UN",0,0,1,negative,neutral
